;meta[language=ru]
2115984725|00000000||Но я думаю, что местные сирены не будут такими приветливыми, как мои сёстры-русалки из Бремервоорда.
2115984726|00000000||Это мне не помешает.
2115984727|00000000||Спасибо за помощь.
2115984728|00000000||Спасибо тебе за твой визит, Геральт.
2115984729|00000000||Не сомневаюсь, что у тебя всё получится.
2115984730|00000000||Скоро увидимся.
2115984731|00000000||Это была бы слишком длинная история, чтобы ее рассказывать.
;
2115984750|00000000||Отомсти за эту бедную девушку.
2115984751|00000000||Из вас получилась бы очень милая пара.
;
2115984760|00000000||Я уверен, что у тебя всё получится.
;
2115984770|00000000||Йен здесь больше нет.
2115984771|00000000||Должно быть она узнала, что у нас получилось.
2115984772|00000000||И покинула Скеллиге, как и планировала.
;
2115984790|00000000||У Йен, должно быть, было время, чтобы найти нужную ей информацию
2115984791|00000000||Я должен вернуться к ней.
2115984800|00000000||Это слишком опасно.
2115984801|00000000||Ты не знаешь, с чем собираешься сражаться.
2115984802|00000000||Цири?
2115984803|00000000||Йеннифэр сказала мне, о чём ты её попросил.
2115984804|00000000||И тогда я вспомнила маленький томик Эсси Давен в красивом переплете под названием "Голубая жемчужина".
2115984805|00000000||Я прочитала его в детстве, когда тренировалась с Йеннифэр в храме Мелитэле.
2115984806|00000000||Эта книга наполнила меня эмоциями,
2115984807|00000000||и теперь я понимаю почему.
2115984808|00000000||Я не хотела бы прерывать тебя.
2115984809|00000000||но знайте, что мои исследования принесли свои плоды.
2115984810|00000000||Моя интуиция была верна.
2115984811|00000000||Объект, связывающий вас с умершим, действительно пригодится.
2115984812|00000000||Как я и боялась,
2115984813|00000000||это не позволит тебе уничтожить эту тварь,
2115984814|00000000||но это поможет отправить его туда, откуда он пришел,
2115984815|00000000||и довольно на долго.
2115984816|00000000||У тебя есть одна из этих жемчужин?
2115984817|00000000||Тебе придется положить её на могилу своей подруги.
2115984818|00000000||Это вызовет и ослабит демона.
2115984819|00000000||Все, что вам затем нужно будет сделать, это использовать свои навыки в бою.
2115984820|00000000||"Вам"? Что ты имеешь в виду?
2115984821|00000000||Я иду с тобой.
2115984822|00000000||Я не знала Эсси Давен,
2115984823|00000000||но теперь я знаю, что скрывалось за этими утонченными балладами,
2115984824|00000000||И я сразу же захотела помочь тебе уничтожить этого демона.
2115984825|00000000||Это слишком опасно.
2115984826|00000000||Я иду один.
2115984827|00000000||Об этом не может быть и речи.
2115984828|00000000||Даже с ослабленным,
2115984829|00000000||лучше сражаться с ним вдвоём.
2115984830|00000000||Мне это не нравится, но, думаю, у меня нет выбора.
2115984831|00000000||Точно.
2115984832|00000000||Очень хорошо…
2115984833|00000000||Ты готова?
2115984834|00000000||Я была готова с той самой минуты, как пришла сюда.
2115984835|00000000||Тогда идём.
2115984836|00000000||Возвращайтесь ко мне невредимыми.
2115984837|00000000||Ты не знаешь, с чем хочешь сразиться.
2115984838|00000000||Я уже сталкивалась с некоторыми очень могущественными существами раньше.
;
2115984900|00000000||Здесь покоится Эсси.
2115984901|00000000||Я положу жемчужину на её могилу.
2115984902|00000000||Да, давай покончим с этим.
2115984903|00000000||Работает!
2115984904|00000000||Будь наготове.
2115984905|00000000||Но что за…
2115984906|00000000||В конце концов, похоже, что именно я принял решение о нашей следующей встрече.
2115984907|00000000||И она будет последней.
2115984908|00000000||Вижу, ты пришёл не один.
2115984909|00000000||Досадно…
2115984910|00000000||Я мог бы её использовать однажды.
2115984911|00000000||Но вы не оставили мне выбора, крома как убить вас двоих прямо сейчас.
2115984912|00000000||Это мы ещё посмотрим…
